[
  {
    "id": "REKU-BULLMQ-001",
    "repository": "bullmq",
    "domain": "Queue, Broker & Distributed Workflow Systems",
    "objectType": "BEHAVIORAL_INVARIANT",
    "claim": "Lock release is executed via an atomic Lua script that compares the stored lock token against the caller token before deleting, preventing slow workers from releasing locks acquired by successor workers.",
    "mechanism": "Atomic Lua Token-Fenced Job Lock Removal",
    "applicabilityConditions": [
      "Requires Redis server with Lua scripting support."
    ],
    "evidenceIds": [
      "OBS-BULLMQ-001"
    ],
    "commonKeywords": [
      "lua_atomicity",
      "token_fencing",
      "redis_lock",
      "ownership_release",
      "lock_safety"
    ],
    "uniqueKeywords": [
      "removeLock_lua",
      "redis_call_get_del",
      "bullmq_lock_token"
    ],
    "localContext": "In BullMQ, workers maintain an active lock in Redis. If a worker stalls beyond its lock TTL and a second worker picks up the job, the stalled worker waking up must not delete the lock now held by the second worker. An atomic Lua CAS script enforces token ownership check.",
    "sourceProvenance": {
      "filePath": "src/commands/includes/removeLock.lua",
      "lineRange": [
        1,
        5
      ],
      "queryOrCodeSnippet": "if redis.call('get', KEYS[1]) == ARGV[1] then return redis.call('del', KEYS[1]) else return 0 end"
    },
    "testProvenance": {
      "filePath": "tests/lock_manager.test.ts",
      "testName": "test lock release with token"
    },
    "epistemicLabels": [
      "SOURCE_OBSERVED",
      "TEST_OBSERVED"
    ],
    "abstractionLevel": "REPO_LOCAL",
    "status": "ACTIVE",
    "substrate": "redis",
    "linkedDomainEkus": [
      "EKU-QUEUE-002",
      "EKU-QUEUE-015"
    ],
    "linkedClaims": [
      "CLM-002",
      "CLM-015"
    ],
    "keywordFacets": {
      "concurrencyControl": [
        "token_fencing",
        "redis_lock",
        "lock_safety"
      ],
      "stateStorage": [
        "redis"
      ],
      "ownershipModel": [
        "lease_based"
      ],
      "substrate": [
        "redis"
      ]
    }
  },
  {
    "id": "REKU-BULLMQ-002",
    "repository": "bullmq",
    "domain": "Queue, Broker & Distributed Workflow Systems",
    "objectType": "IMPLEMENTATION_PATTERN",
    "claim": "Delayed and scheduled jobs are indexed in Redis Sorted Sets (ZSET) scored by execution timestamp, where workers poll and promote due jobs atomically into active queues.",
    "mechanism": "Redis Sorted Set Delayed Timestamp Scheduling",
    "applicabilityConditions": [
      "Requires Redis sorted sets with millisecond score precision."
    ],
    "evidenceIds": [
      "OBS-BULLMQ-002"
    ],
    "commonKeywords": [
      "delayed_jobs",
      "zset_scheduling",
      "timestamp_scoring",
      "redis_scheduler"
    ],
    "uniqueKeywords": [
      "bullmq_delayed_set",
      "zrangebyscore_promotion",
      "moveToActive_lua"
    ],
    "localContext": "BullMQ implements delayed tasks using Redis ZSETs where the score is the epoch millisecond at which the job becomes eligible for processing. Lua scripts atomically move due jobs from the delay ZSET to the wait list.",
    "sourceProvenance": {
      "filePath": "src/commands/moveToActive-11.lua",
      "lineRange": [
        15,
        30
      ],
      "queryOrCodeSnippet": "local delayed = redis.call('zrangebyscore', KEYS[2], 0, ARGV[1], 'LIMIT', 0, 1)"
    },
    "testProvenance": {
      "filePath": "tests/delay.test.ts",
      "testName": "test delayed job execution after timestamp"
    },
    "epistemicLabels": [
      "SOURCE_OBSERVED",
      "TEST_OBSERVED"
    ],
    "abstractionLevel": "REPO_LOCAL",
    "status": "ACTIVE",
    "substrate": "redis",
    "linkedDomainEkus": [
      "EKU-QUEUE-005",
      "EKU-QUEUE-008"
    ],
    "linkedClaims": [
      "CLM-005",
      "CLM-008"
    ],
    "keywordFacets": {
      "concurrencyControl": [],
      "stateStorage": [
        "redis"
      ],
      "ownershipModel": [
        "lease_based"
      ],
      "substrate": [
        "redis"
      ]
    }
  },
  {
    "id": "REKU-BULLMQ-003",
    "repository": "bullmq",
    "domain": "Queue, Broker & Distributed Workflow Systems",
    "objectType": "BEHAVIORAL_INVARIANT",
    "claim": "Execution retry attempts and worker stall loss incidents are incremented on separate dedicated counters (attemptsMade vs stalledCounter) in prepareJobForProcessing.lua, ensuring process crash recovery does not mask business execution limits.",
    "mechanism": "Separate Attempt and Worker-Loss Counters in Redis Hash",
    "applicabilityConditions": [
      "Requires Redis hash storage for job metadata with atomic field incrementing."
    ],
    "evidenceIds": [
      "OBS-BULLMQ-004"
    ],
    "commonKeywords": [
      "attempt_counter_separation",
      "worker_loss_tracking",
      "stalled_counter",
      "crash_vs_business_error"
    ],
    "uniqueKeywords": [
      "prepareJobForProcessing_lua",
      "bullmq_attemptsStarted",
      "stalledCounter"
    ],
    "localContext": "BullMQ tracks both how many times a job was picked up by a worker (attemptsMade) and how many times it was detected as stalled after an ungraceful crash (stalledCounter), preventing a crashing node from silently burning normal retry budgets.",
    "sourceProvenance": {
      "filePath": "src/commands/includes/prepareJobForProcessing.lua",
      "lineRange": [
        10,
        30
      ],
      "queryOrCodeSnippet": "redis.call('HINCRBY', KEYS[1], 'attemptsStarted', 1)",
      "symbol": "attemptsStarted"
    },
    "testProvenance": {
      "filePath": "tests/worker.test.ts",
      "testName": "test separate attempt vs stalled counters"
    },
    "epistemicLabels": [
      "SOURCE_OBSERVED",
      "TEST_OBSERVED"
    ],
    "abstractionLevel": "REPO_LOCAL",
    "status": "ACTIVE",
    "substrate": "redis",
    "linkedDomainEkus": [
      "EKU-QUEUE-001"
    ],
    "linkedClaims": [
      "CLM-001"
    ],
    "keywordFacets": {
      "concurrencyControl": [],
      "stateStorage": [
        "redis"
      ],
      "ownershipModel": [
        "lease_based"
      ],
      "substrate": [
        "redis"
      ]
    }
  },
  {
    "id": "REKU-BULLMQ-004",
    "repository": "bullmq",
    "domain": "Queue, Broker & Distributed Workflow Systems",
    "objectType": "FAILURE_RECOVERY_MECHANISM",
    "claim": "When a task repeatedly triggers worker crashes or stalls beyond maxStalledCount, moveStalledJobsToWait immediately moves the job to the failed state, isolating poison payloads from infinite recovery loops.",
    "mechanism": "Stalled Job Max-Count Quarantine DLQ Isolation",
    "applicabilityConditions": [
      "Requires Redis set and hash inspection during periodic stalled job check cycles."
    ],
    "evidenceIds": [
      "OBS-BULLMQ-005"
    ],
    "commonKeywords": [
      "poison_payload_isolation",
      "dead_letter_quarantine",
      "stall_exhaustion",
      "max_stalled_limit"
    ],
    "uniqueKeywords": [
      "moveStalledJobsToWait_lua",
      "maxStalledCount",
      "moveToFailed_lua"
    ],
    "localContext": "BullMQ's stalled check cycle marks jobs that have exceeded maxStalledCount (default 1) and moves them directly to the failed queue with an Error('job stalled more than maxStalledCount'), stopping repeated worker crash loops.",
    "sourceProvenance": {
      "filePath": "src/commands/moveStalledJobsToWait-9.lua",
      "lineRange": [
        25,
        45
      ],
      "queryOrCodeSnippet": "if stalledCount >= maxStalledCount then moveToFailed(jobKey) end",
      "symbol": "repeatable stalled handling"
    },
    "testProvenance": {
      "filePath": "tests/stalled_jobs.test.ts",
      "testName": "test move stalled job to failed when maxStalledCount exceeded"
    },
    "epistemicLabels": [
      "SOURCE_OBSERVED",
      "TEST_OBSERVED"
    ],
    "abstractionLevel": "REPO_LOCAL",
    "status": "ACTIVE",
    "substrate": "redis",
    "linkedDomainEkus": [
      "EKU-QUEUE-001"
    ],
    "linkedClaims": [
      "CLM-001"
    ],
    "keywordFacets": {
      "concurrencyControl": [],
      "stateStorage": [
        "redis"
      ],
      "ownershipModel": [
        "lease_based"
      ],
      "substrate": [
        "redis"
      ]
    }
  }
]