[
  {
    "id": "REKU-RIVER-001",
    "repository": "river",
    "domain": "Queue, Broker & Distributed Workflow Systems",
    "objectType": "IMPLEMENTATION_PATTERN",
    "claim": "PostgreSQL FOR UPDATE SKIP LOCKED allows concurrent worker pools to acquire non-overlapping available jobs without table-level locking or head-of-line stalls.",
    "mechanism": "Relational Lock-Free Dequeue (FOR UPDATE SKIP LOCKED)",
    "applicabilityConditions": [
      "Requires PostgreSQL 9.5+ or compatible MVCC relational store supporting row-level SKIP LOCKED."
    ],
    "evidenceIds": [
      "OBS-RIVER-001"
    ],
    "commonKeywords": [
      "skip_locked",
      "postgres",
      "mvcc_dequeue",
      "lock_avoidance",
      "row_locking"
    ],
    "uniqueKeywords": [
      "riverpgxv5",
      "river_job_state_available",
      "priority_scheduled_order"
    ],
    "localContext": "River implements its primary job queue inside PostgreSQL. To scale to dozens of concurrent Go worker goroutines without transaction serialization failures, it relies on FOR UPDATE SKIP LOCKED in its sqlc-generated query.",
    "sourceProvenance": {
      "filePath": "riverdriver/riverpgxv5/internal/dbsqlc/river_job.sql",
      "lineRange": [
        200,
        230
      ],
      "queryOrCodeSnippet": "SELECT id, args, attempt, state FROM river_job WHERE state = 'available' ORDER BY priority ASC, scheduled_at ASC LIMIT $1 FOR UPDATE SKIP LOCKED;"
    },
    "testProvenance": {
      "filePath": "internal/jobexecutor/job_executor_test.go",
      "testName": "TestJobExecutor_WorkOnce"
    },
    "epistemicLabels": [
      "SOURCE_OBSERVED",
      "TEST_OBSERVED"
    ],
    "abstractionLevel": "REPO_LOCAL",
    "status": "ACTIVE",
    "substrate": "postgres",
    "linkedDomainEkus": [
      "EKU-QUEUE-001",
      "EKU-QUEUE-007"
    ],
    "linkedClaims": [
      "CLM-001",
      "CLM-007"
    ],
    "keywordFacets": {
      "concurrencyControl": [
        "skip_locked",
        "lock_avoidance",
        "row_locking"
      ],
      "stateStorage": [
        "postgres"
      ],
      "ownershipModel": [
        "lease_based"
      ],
      "substrate": [
        "postgres"
      ]
    }
  },
  {
    "id": "REKU-RIVER-002",
    "repository": "river",
    "domain": "Queue, Broker & Distributed Workflow Systems",
    "objectType": "BEHAVIORAL_INVARIANT",
    "claim": "All state transitions and job finalizations include WHERE id = $1 AND attempt = $2, guaranteeing stale workers waking up after pause mutate 0 rows.",
    "mechanism": "Storage-Fenced Generation/Epoch Mutation Update",
    "applicabilityConditions": [
      "Requires atomic CAS or SQL relational write condition on monotonic attempt counter."
    ],
    "evidenceIds": [
      "OBS-RIVER-002"
    ],
    "commonKeywords": [
      "epoch_fencing",
      "attempt_fencing",
      "stale_worker_protection",
      "cas_update",
      "split_brain_defense"
    ],
    "uniqueKeywords": [
      "river_job_finalized_at",
      "attempt_counter_match",
      "returning_id"
    ],
    "localContext": "Because River allows jobs to be rescued and reassigned after lease timeouts, a slow or delayed worker might finish after a new worker has already claimed the job. The attempt predicate ensures the superseded worker's write safely affects 0 rows.",
    "sourceProvenance": {
      "filePath": "riverdriver/riverpgxv5/internal/dbsqlc/river_job.sql",
      "lineRange": [
        200,
        230
      ],
      "queryOrCodeSnippet": "UPDATE river_job SET state = 'completed', finalized_at = now() WHERE id = $1 AND attempt = $2 RETURNING id;"
    },
    "testProvenance": {
      "filePath": "internal/jobexecutor/job_executor_test.go",
      "testName": "TestJobExecutor_StaleAttemptFencing"
    },
    "epistemicLabels": [
      "SOURCE_OBSERVED",
      "TEST_OBSERVED"
    ],
    "abstractionLevel": "REPO_LOCAL",
    "status": "ACTIVE",
    "substrate": "postgres",
    "linkedDomainEkus": [
      "EKU-QUEUE-002",
      "EKU-QUEUE-015"
    ],
    "linkedClaims": [
      "CLM-002",
      "CLM-015"
    ],
    "keywordFacets": {
      "concurrencyControl": [
        "epoch_fencing",
        "attempt_fencing"
      ],
      "stateStorage": [
        "postgres"
      ],
      "ownershipModel": [
        "lease_based"
      ],
      "substrate": [
        "postgres"
      ]
    }
  },
  {
    "id": "REKU-RIVER-003",
    "repository": "river",
    "domain": "Queue, Broker & Distributed Workflow Systems",
    "objectType": "FAILURE_RECOVERY_MECHANISM",
    "claim": "Worker routines bind execution to parent cancellation contexts, interrupting in-flight jobs immediately when client contexts disconnect.",
    "mechanism": "Context / AbortSignal Worker Cancellation Propagation",
    "applicabilityConditions": [
      "Requires language runtime supporting cooperative cancellation contexts (Go context.Context, JS AbortSignal)."
    ],
    "evidenceIds": [
      "OBS-RIVER-001"
    ],
    "commonKeywords": [
      "context_cancellation",
      "abort_signal",
      "graceful_shutdown",
      "interrupt_propagation"
    ],
    "uniqueKeywords": [
      "parentCtx",
      "cancelChan",
      "job_worker_goroutine"
    ],
    "localContext": "River leverages Go standard library context.Context to ensure shutdown signals, timeout deadlines, and client cancellations propagate directly into the user-provided Work function.",
    "sourceProvenance": {
      "filePath": "internal/jobexecutor/job_executor.go",
      "lineRange": [
        50,
        75
      ],
      "queryOrCodeSnippet": "ctx, cancel := context.WithCancel(parentCtx); defer cancel(); go func() { <-cancelChan; cancel() }(); worker.Work(ctx, job)"
    },
    "testProvenance": {
      "filePath": "example_graceful_shutdown_test.go",
      "testName": "Example_gracefulShutdown"
    },
    "epistemicLabels": [
      "SOURCE_OBSERVED",
      "TEST_OBSERVED"
    ],
    "abstractionLevel": "REPO_LOCAL",
    "status": "ACTIVE",
    "substrate": "postgres",
    "linkedDomainEkus": [
      "EKU-QUEUE-012",
      "EKU-QUEUE-020"
    ],
    "linkedClaims": [
      "CLM-012",
      "CLM-020"
    ],
    "keywordFacets": {
      "concurrencyControl": [],
      "stateStorage": [
        "postgres"
      ],
      "ownershipModel": [
        "lease_based"
      ],
      "substrate": [
        "postgres"
      ]
    }
  },
  {
    "id": "REKU-RIVER-004",
    "repository": "river",
    "domain": "Queue, Broker & Distributed Workflow Systems",
    "objectType": "BEHAVIORAL_INVARIANT",
    "claim": "JobSetStateCompleted sets state to completed or discarded based on max_attempts threshold comparison, recording distinct attempt increments per claim cycle in relational storage.",
    "mechanism": "Relational Attempt Counter Lifecycle and Max-Attempt Discard",
    "applicabilityConditions": [
      "Requires PostgreSQL relational schema tracking integer attempt and max_attempts."
    ],
    "evidenceIds": [
      "OBS-RIVER-006"
    ],
    "commonKeywords": [
      "attempt_counter",
      "fenced_result_promotion",
      "max_attempts_discard",
      "outbox_emission"
    ],
    "uniqueKeywords": [
      "JobSetStateCompleted",
      "river_job_state_completed",
      "river_job_state_discarded"
    ],
    "localContext": "River explicitly increments the attempt integer on every fetch and compares it against max_attempts when handling errors; if attempt >= max_attempts the job transitions to discarded rather than retryable.",
    "sourceProvenance": {
      "filePath": "riverdriver/riverdatabasesql/internal/dbsqlc/river_job.sql.go",
      "lineRange": [
        150,
        180
      ],
      "queryOrCodeSnippet": "UPDATE river_job SET state = CASE WHEN attempt >= max_attempts THEN 'discarded'::river_job_state ELSE 'available'::river_job_state END WHERE id = $1 AND attempt = $2",
      "symbol": "JobSetStateCompleted"
    },
    "testProvenance": {
      "filePath": "internal/jobexecutor/job_executor_test.go",
      "testName": "TestJobExecutor_MaxAttemptsDiscard"
    },
    "epistemicLabels": [
      "SOURCE_OBSERVED",
      "TEST_OBSERVED"
    ],
    "abstractionLevel": "REPO_LOCAL",
    "status": "ACTIVE",
    "substrate": "postgres",
    "linkedDomainEkus": [
      "EKU-QUEUE-001"
    ],
    "linkedClaims": [
      "CLM-001"
    ],
    "keywordFacets": {
      "concurrencyControl": [],
      "stateStorage": [
        "postgres"
      ],
      "ownershipModel": [
        "lease_based"
      ],
      "substrate": [
        "postgres"
      ]
    }
  }
]