[
  {
    "id": "REKU-LITEQUEUE-001",
    "repository": "litequeue",
    "domain": "Queue, Broker & Distributed Workflow Systems",
    "objectType": "IMPLEMENTATION_PATTERN",
    "claim": "Atomic step dequeue in SQLite uses BEGIN IMMEDIATE and UPDATE ... WHERE rowid = (SELECT rowid ... LIMIT 1) RETURNING *, preventing concurrent worker deadlocks on single-file SQLite databases.",
    "mechanism": "Atomic SQLite BEGIN IMMEDIATE Step Dequeue",
    "applicabilityConditions": [
      "Requires SQLite 3.35+ supporting RETURNING clauses and immediate write transactions."
    ],
    "evidenceIds": [
      "OBS-LITEQUEUE-001"
    ],
    "commonKeywords": [
      "sqlite_immediate",
      "atomic_pop",
      "single_file_database",
      "step_dequeue",
      "returning_clause"
    ],
    "uniqueKeywords": [
      "begin_immediate_transaction",
      "litequeue_init_py",
      "messages_locked_at"
    ],
    "localContext": "Litequeue provides an embedded persistent queue backed by SQLite. Because standard SQLite transactions begin in DEFERRED mode, multiple concurrent readers attempting to write can deadlock with SQLITE_BUSY; BEGIN IMMEDIATE acquires a reserved lock immediately.",
    "sourceProvenance": {
      "filePath": "src/litequeue/__init__.py",
      "lineRange": [
        40,
        50
      ],
      "queryOrCodeSnippet": "cursor.execute('BEGIN IMMEDIATE'); cursor.execute('UPDATE _messages SET status = 1, locked_at = ? WHERE rowid = (SELECT rowid FROM _messages WHERE status = 0 LIMIT 1) RETURNING *')"
    },
    "testProvenance": {
      "filePath": "tests/test_litequeue.py",
      "testName": "test_concurrent_pop"
    },
    "epistemicLabels": [
      "SOURCE_OBSERVED",
      "TEST_OBSERVED"
    ],
    "abstractionLevel": "REPO_LOCAL",
    "status": "ACTIVE",
    "substrate": "sqlite",
    "linkedDomainEkus": [
      "EKU-QUEUE-001",
      "EKU-QUEUE-007"
    ],
    "linkedClaims": [
      "CLM-001",
      "CLM-007"
    ],
    "keywordFacets": {
      "concurrencyControl": [],
      "stateStorage": [
        "sqlite"
      ],
      "ownershipModel": [
        "lease_based"
      ],
      "substrate": [
        "sqlite"
      ]
    }
  }
]