[
  {
    "id": "REKU-ASYNQ-001",
    "repository": "asynq",
    "domain": "Queue, Broker & Distributed Workflow Systems",
    "objectType": "BEHAVIORAL_INVARIANT",
    "claim": "Task lease expiration is evaluated authoritative to the Redis storage clock via ZRANGEBYSCORE on active deadline sorted sets, preventing client worker clock drift from causing premature task reassignment.",
    "mechanism": "Redis Storage-Time Lease Expiration Sweep",
    "applicabilityConditions": [
      "Requires Redis sorted sets with millisecond precision timestamp scoring."
    ],
    "evidenceIds": [
      "OBS-ASYNQ-003"
    ],
    "commonKeywords": [
      "storage_time_lease",
      "clock_skew_defense",
      "lease_recovery",
      "zrangebyscore_sweep"
    ],
    "uniqueKeywords": [
      "asynq_active_set",
      "recoverLeaseExpiredTasks",
      "deadline_score"
    ],
    "localContext": "Asynq delegates lease recovery to a background syncer routine that queries Redis using ZRANGEBYSCORE with current Redis server epoch time, ensuring workers on drifting VMs cannot incorrectly reclaim active tasks.",
    "sourceProvenance": {
      "filePath": "internal/rdb/rdb.go",
      "lineRange": [
        110,
        130
      ],
      "queryOrCodeSnippet": "zrangebyscore asynq:{queue}:active 0 {now_timestamp}",
      "symbol": "recoverLeaseExpiredTasks"
    },
    "testProvenance": {
      "filePath": "internal/rdb/rdb_test.go",
      "testName": "TestRecoverLeaseExpiredTasks"
    },
    "epistemicLabels": [
      "SOURCE_OBSERVED",
      "TEST_OBSERVED"
    ],
    "abstractionLevel": "REPO_LOCAL",
    "status": "ACTIVE",
    "substrate": "redis",
    "linkedDomainEkus": [
      "EKU-QUEUE-001",
      "EKU-QUEUE-008"
    ],
    "linkedClaims": [
      "CLM-001",
      "CLM-008"
    ],
    "keywordFacets": {
      "concurrencyControl": [
        "clock_skew_defense"
      ],
      "stateStorage": [
        "redis"
      ],
      "ownershipModel": [
        "lease_based"
      ],
      "substrate": [
        "redis"
      ]
    }
  },
  {
    "id": "REKU-ASYNQ-002",
    "repository": "asynq",
    "domain": "Queue, Broker & Distributed Workflow Systems",
    "objectType": "IMPLEMENTATION_PATTERN",
    "claim": "Atomic dequeue executes via Redis EVAL script combining RPOPLPUSH from pending list to active list with immediate lease timestamp insertion into active ZSET.",
    "mechanism": "Atomic Redis Lua Dequeue-and-Lease Allocation",
    "applicabilityConditions": [
      "Requires Redis server with Lua script execution support."
    ],
    "evidenceIds": [
      "OBS-ASYNQ-001"
    ],
    "commonKeywords": [
      "atomic_dequeue",
      "redis_lua_lease",
      "rpoplpush_lease",
      "competing_consumers"
    ],
    "uniqueKeywords": [
      "dequeueCmd",
      "asynq_pending_active",
      "lease_ttl_zset"
    ],
    "localContext": "In Asynq, worker pools execute dequeueCmd to atomically pop a task from the pending queue and add it to the active sorted set with a lease expiration deadline.",
    "sourceProvenance": {
      "filePath": "internal/rdb/rdb.go",
      "lineRange": [
        50,
        70
      ],
      "queryOrCodeSnippet": "local id = redis.call('RPOPLPUSH', KEYS[1], KEYS[2]); if id then redis.call('ZADD', KEYS[3], ARGV[1], id) end; return id",
      "symbol": "dequeueCmd"
    },
    "testProvenance": {
      "filePath": "internal/rdb/rdb_test.go",
      "testName": "TestDequeue"
    },
    "epistemicLabels": [
      "SOURCE_OBSERVED",
      "TEST_OBSERVED"
    ],
    "abstractionLevel": "REPO_LOCAL",
    "status": "ACTIVE",
    "substrate": "redis",
    "linkedDomainEkus": [
      "EKU-QUEUE-005"
    ],
    "linkedClaims": [
      "CLM-005"
    ],
    "keywordFacets": {
      "concurrencyControl": [],
      "stateStorage": [
        "redis"
      ],
      "ownershipModel": [
        "lease_based"
      ],
      "substrate": [
        "redis"
      ]
    }
  }
]